{"artists":[{"assignment_bridge_status":"forced_leaf_preserved_supported_specificity_not_recorded","card_count":10687,"example_card_count":10687,"examples_content_id":"sha256:70a90fc6427efae2a2d8d0ac11452e7ba3d894aaf9415b5b2e3678dac64d074c","index_content_id":"sha256:e444f621d12203caa8124321993da52f2375c616fa3f1f48a32ff271ed8c9862","language":"es","master_content_id":"sha256:e39a1239a61eead10943d4b41e540c325f3b98cf32c8a0482fe5a726fd621bbf","migration_status":"retained_materialized_output_for_product_parity","name":"Bad Bunny","provenance":{"corpus_profile_hash":"sha256:3f06fba5f556d10d1808b95bef655251c338abb5fbb698aada1f0ed70346f968","generated_at":1786791272,"ledger_run":"run_9b10a162edde17313dc83ff5","provenance_status":"observed_sidecar","sidecar_content_id":"sha256:06fe021c9181ce342596ac5385945db5d8c5d2ce557105dc2b8da1a9b01dd61c","source_content_id":"sha256:263be3c9653d92639122708bf89a95219410814a293c4766b20982f8d0978b11","step_name":"assemble_artist_vocabulary","step_version":17},"slug":"bad-bunny","song_count":295,"source_id":"run_9b10a162edde17313dc83ff5","source_master_content_id":"sha256:597703220af76972aceba0fe08c5f0fff485b08e352feeacca45c5b4c3058b62","wsd_evidence_content_id":"sha256:f3187e27b320472dd534696cc29b33a970c1264b3da6264dc51c11d96628682d"},{"assignment_bridge_status":"native_v7_forced_and_supported_available","card_count":3224,"example_card_count":3224,"examples_content_id":"sha256:fc24fb34023b71a993e5a1f6a58ee59e51286fc797489ac5cac44d4f427ca853","index_content_id":"sha256:44e622581abcd87a72ebd67d5269e709dc25ca35c72a7115efaabe208c2e457c","language":"es","master_content_id":"sha256:cff104977b82aa825b17a12b10c56a5c6ea3f4d29b4a4aaaa487022432e6ea76","migration_status":"retained_materialized_output_for_product_parity","name":"Rosalía","provenance":{"corpus_profile_hash":"sha256:cfcdaf2a88a8959084f46fad4ca56373fd72115589201163bfeeec03067f6ad1","generated_at":1787611319,"ledger_run":"run_c9a215f57486286226ae22c9","provenance_status":"observed_sidecar","sidecar_content_id":"sha256:c44bbb9a813d1e656bbff2bcf8507662f31518a570509bbdc8c48954574cbd76","source_content_id":"sha256:fbdd68ad9affc493397118f32da9d2b823d75d3970bf711e8c48bc4838772ac3","step_name":"assemble_artist_vocabulary","step_version":17},"slug":"rosalia","song_count":107,"source_id":"run_c9a215f57486286226ae22c9","source_master_content_id":"sha256:3c121db0bd40b9183c87bca9eb1bb3ef1fe7c34686dda742af95c9b38f24f805","wsd_evidence_content_id":"sha256:beb9b5ae3c2324289e873bcc3e944ef5102d01c1c06f2dafd447225bbf9066eb"},{"assignment_bridge_status":"forced_leaf_preserved_supported_specificity_not_recorded","card_count":1860,"example_card_count":1860,"examples_content_id":"sha256:20d84e785048e211cd0c3a7adf480705ed21603860f6376ce1c5c73a3656cae6","index_content_id":"sha256:d38517742bcdb399b6615912877a493325aa9b5c2fb1a0ac67e56c4c1e91e1e1","language":"es","master_content_id":"sha256:3afe82100c18035a7c0b4369cf16c6009e54b19fb35cbfd248806e48a6d9c085","migration_status":"retained_materialized_output_for_product_parity","name":"Joshua's Test Playlist","provenance":{"corpus_profile_hash":"sha256:5a8dc9362657203385e89765b3b26327ec50ae6ef4399388ea327a69343e6c96","generated_at":1787405000,"ledger_run":"run_a72334c21c1d593be651837e","provenance_status":"observed_sidecar","sidecar_content_id":"sha256:1054f2c099206fc48fca3a5baf5a72fedf7c612d6e0c290f3285922549dcce15","source_content_id":"sha256:eadf6b789ec885fbdcdf5f6ccb1296f95cd32a2448e44dd346f4c265bdb99608","step_name":"assemble_artist_vocabulary","step_version":17},"slug":"spanish-test-playlist","song_count":31,"source_id":"run_a72334c21c1d593be651837e","source_master_content_id":"sha256:597703220af76972aceba0fe08c5f0fff485b08e352feeacca45c5b4c3058b62","wsd_evidence_content_id":"sha256:091a6bc2c6c1f2dc6485e596d32e88b694d882d4dc8f0b1454a2c531c6a21d60"},{"assignment_bridge_status":"forced_leaf_preserved_supported_specificity_not_recorded","card_count":1455,"example_card_count":1455,"examples_content_id":"sha256:c24f7105792b577b5e087b6eafb7fb4a340fb48c2d84315adb5cbb04f841b5b9","index_content_id":"sha256:6cf6987bed32c30bfec881710af93eb310c3e3eb3809517d9fabd338c7abdaae","language":"fr","master_content_id":"sha256:d49c5c58d750d0ef300633ba82b0d81e9479aa508027422bff49f3d7840eb320","migration_status":"retained_materialized_output_for_product_parity","name":"TestPlaylist (French)","provenance":{"corpus_profile_hash":null,"generated_at":1776556973,"ledger_run":null,"provenance_status":"observed_sidecar","sidecar_content_id":"sha256:75979dfd98790dd0e0a6a0bf7d4ce9c343e7ce3a8b5c82b7c6494b6a3d6d0c50","source_content_id":"sha256:65b4c0658f8f6745c0554edfd3c89dde143ce97e5fe06c1288eb844f84f8cc96","step_name":"assemble_artist_vocabulary","step_version":1},"slug":"testplaylist","song_count":0,"source_id":"sha256:65b4c0658f8f6745c0554edfd3c89dde143ce97e5fe06c1288eb844f84f8cc96","source_master_content_id":"sha256:bb3af52d09fa95aa42870ca72b2fd61c32c85c6414b6e7157a34f28ec0b910e8","wsd_evidence_content_id":"sha256:e55701e3c4e4799dc3ead5b4bf9c68543c1493327653dbfbec1678291481aa13"},{"assignment_bridge_status":"forced_leaf_preserved_supported_specificity_not_recorded","card_count":4461,"example_card_count":4461,"examples_content_id":"sha256:052413e457f64391b1e99b5574f5ce1f20a881ad0c9be0d05b0ed18fe45ce5cd","index_content_id":"sha256:dd5dc20d9931310cc93fbec43df200cb0141549935830a9a4a71b44c48d872dd","language":"es","master_content_id":"sha256:0eba956bb659c65c23c49013437f43d66cdf0cbb35a3bb39c5ab0e61d0cfa5e5","migration_status":"retained_materialized_output_for_product_parity","name":"Young Miko","provenance":{"corpus_profile_hash":"sha256:ec4934ade41a453d9f6f6e345e274156159f82dd17064fc9f256be3ed7e5fd74","generated_at":1786791321,"ledger_run":"run_c5e460491cd359b3e686b435","provenance_status":"observed_sidecar","sidecar_content_id":"sha256:9f70684d9cef317353d895b582a3266765c13d758af72f3ab37d866a93c23cc8","source_content_id":"sha256:a7b1f74b87ffd8680d451b93530acd5a68515d460023ebaa725e87b4c1526cc3","step_name":"assemble_artist_vocabulary","step_version":17},"slug":"young-miko","song_count":90,"source_id":"run_c5e460491cd359b3e686b435","source_master_content_id":"sha256:597703220af76972aceba0fe08c5f0fff485b08e352feeacca45c5b4c3058b62","wsd_evidence_content_id":"sha256:41211e498c16b824e2fd766eb495ad2a9401040cf25ccf9cc1c593010a967ace"}],"composition_version":"lyrics-release-composition/v1","conflict_policy":"error","created_at":"2026-08-25T03:39:41.118990Z","fallback_policy":"none","layers":{"artist:bad-bunny":{"artifact_ids":{"examples":"sha256:70a90fc6427efae2a2d8d0ac11452e7ba3d894aaf9415b5b2e3678dac64d074c","index":"sha256:e444f621d12203caa8124321993da52f2375c616fa3f1f48a32ff271ed8c9862","master":"sha256:e39a1239a61eead10943d4b41e540c325f3b98cf32c8a0482fe5a726fd621bbf","wsd_evidence":"sha256:f3187e27b320472dd534696cc29b33a970c1264b3da6264dc51c11d96628682d"},"requires":{},"source_id":"run_9b10a162edde17313dc83ff5","source_type":"retained_materialized_output"},"artist:rosalia":{"artifact_ids":{"examples":"sha256:fc24fb34023b71a993e5a1f6a58ee59e51286fc797489ac5cac44d4f427ca853","index":"sha256:44e622581abcd87a72ebd67d5269e709dc25ca35c72a7115efaabe208c2e457c","master":"sha256:cff104977b82aa825b17a12b10c56a5c6ea3f4d29b4a4aaaa487022432e6ea76","wsd_evidence":"sha256:beb9b5ae3c2324289e873bcc3e944ef5102d01c1c06f2dafd447225bbf9066eb"},"requires":{},"source_id":"run_c9a215f57486286226ae22c9","source_type":"retained_materialized_output"},"artist:spanish-test-playlist":{"artifact_ids":{"examples":"sha256:20d84e785048e211cd0c3a7adf480705ed21603860f6376ce1c5c73a3656cae6","index":"sha256:d38517742bcdb399b6615912877a493325aa9b5c2fb1a0ac67e56c4c1e91e1e1","master":"sha256:3afe82100c18035a7c0b4369cf16c6009e54b19fb35cbfd248806e48a6d9c085","wsd_evidence":"sha256:091a6bc2c6c1f2dc6485e596d32e88b694d882d4dc8f0b1454a2c531c6a21d60"},"requires":{},"source_id":"run_a72334c21c1d593be651837e","source_type":"retained_materialized_output"},"artist:testplaylist":{"artifact_ids":{"examples":"sha256:c24f7105792b577b5e087b6eafb7fb4a340fb48c2d84315adb5cbb04f841b5b9","index":"sha256:6cf6987bed32c30bfec881710af93eb310c3e3eb3809517d9fabd338c7abdaae","master":"sha256:d49c5c58d750d0ef300633ba82b0d81e9479aa508027422bff49f3d7840eb320","wsd_evidence":"sha256:e55701e3c4e4799dc3ead5b4bf9c68543c1493327653dbfbec1678291481aa13"},"requires":{},"source_id":"sha256:65b4c0658f8f6745c0554edfd3c89dde143ce97e5fe06c1288eb844f84f8cc96","source_type":"retained_materialized_output"},"artist:young-miko":{"artifact_ids":{"examples":"sha256:052413e457f64391b1e99b5574f5ce1f20a881ad0c9be0d05b0ed18fe45ce5cd","index":"sha256:dd5dc20d9931310cc93fbec43df200cb0141549935830a9a4a71b44c48d872dd","master":"sha256:0eba956bb659c65c23c49013437f43d66cdf0cbb35a3bb39c5ab0e61d0cfa5e5","wsd_evidence":"sha256:41211e498c16b824e2fd766eb495ad2a9401040cf25ccf9cc1c593010a967ace"},"requires":{},"source_id":"run_c5e460491cd359b3e686b435","source_type":"retained_materialized_output"}},"mode":"lyrics","omitted_layers":[{"layer":"clean_artist_pipeline_rebuild","reason":"materialized parity assets retained; assignments were not recomputed"}],"publication_status":"inactive_migration_audit","release_id":"lyrics-all-artists-v7-native-20260825b"}
